{
  "$schema": "http://json-schema.org/draft-07/schema#",
  "title": "EasyDiffAnalysis",
  "type": "object",
  "additionalProperties": false,
  "required": ["version", "merge_request", "overview", "steps"],
  "properties": {
    "version": {
      "const": "1.0"
    },
    "merge_request": {
      "type": "object",
      "additionalProperties": false,
      "required": ["title", "source_branch", "target_branch", "base_sha", "head_sha"],
      "properties": {
        "id": {
          "type": ["string", "null"],
          "description": "The MR/PR number if one is known from context (e.g. '!418'). Null if there is none — never invent one."
        },
        "title": {
          "type": "string",
          "description": "A short, human headline for this change (not a commit message)."
        },
        "source_branch": {
          "type": "string",
          "description": "The branch being reviewed, from `git rev-parse --abbrev-ref HEAD`."
        },
        "target_branch": {
          "type": "string",
          "description": "The base branch this is being compared against."
        },
        "base_sha": {
          "type": "string",
          "description": "The merge-base commit, from `git merge-base <target_branch> HEAD`."
        },
        "head_sha": {
          "type": "string",
          "description": "The commit being reviewed, from `git rev-parse HEAD`."
        }
      }
    },
    "overview": {
      "type": "object",
      "additionalProperties": false,
      "required": ["what", "why", "mental_model", "decisions", "risks", "estimated_reading_minutes"],
      "properties": {
        "what": {
          "type": "string",
          "description": "A plain-language narrative of what changed, without quoting code."
        },
        "why": {
          "type": "string",
          "description": "The problem or goal this change addresses."
        },
        "mental_model": {
          "type": "string",
          "description": "How the pieces of this change fit together, in the order data or control flows through them. Introduces each domain concept in plain words before naming the code that implements it. Plain text; separate paragraphs with a blank line."
        },
        "decisions": {
          "type": "array",
          "items": {
            "type": "object",
            "additionalProperties": false,
            "required": ["choice", "reason"],
            "properties": {
              "choice": { "type": "string", "description": "The choice that was made, stated plainly." },
              "reason": { "type": "string", "description": "Why — including what was rejected, when that's what a reviewer would ask about." }
            }
          },
          "description": "The design choices a reviewer is likely to question. Empty if none is worth calling out."
        },
        "risks": {
          "type": "string",
          "description": "The main risk or trade-off a reviewer should keep in mind overall. An empty string if there is no real one."
        },
        "estimated_reading_minutes": {
          "type": "integer",
          "minimum": 1,
          "description": "A rough estimate of how long a careful reviewer would take to read this report."
        }
      }
    },
    "steps": {
      "type": "array",
      "minItems": 1,
      "items": {
        "type": "object",
        "additionalProperties": false,
        "required": ["id", "kind", "title", "narrative", "files"],
        "properties": {
          "id": {
            "type": "string",
            "description": "A short, stable, kebab-case slug for this step (e.g. 'invalidation')."
          },
          "kind": {
            "type": "string",
            "enum": ["foundation", "core", "wiring", "delicate", "tests"],
            "description": "foundation: data/schema/contracts this step's logic depends on. core: the main logic. wiring: integrating that logic with its callers. delicate: a step that carries real risk and deserves the closest reading. tests: test coverage."
          },
          "title": { "type": "string" },
          "narrative": {
            "type": "string",
            "description": "What this step does and why it was done this way, written as connected reasoning for a reviewer who doesn't know this module. Plain text; separate paragraphs with a blank line."
          },
          "files": {
            "type": "array",
            "minItems": 1,
            "items": {
              "type": "object",
              "additionalProperties": false,
              "required": ["path", "change_type", "confidence", "hunks"],
              "properties": {
                "path": {
                  "type": "string",
                  "description": "Repo-relative path of a file touched in this step, exactly as it appears in the diff."
                },
                "change_type": {
                  "type": "string",
                  "enum": ["added", "modified", "deleted", "renamed"]
                },
                "why": {
                  "type": "string",
                  "description": "Why this specific file changed this way, explained to a reviewer. Omit it when the step's narrative already makes that obvious."
                },
                "confidence": {
                  "type": "string",
                  "enum": ["high", "medium", "low"],
                  "description": "How confident you are that this file's role is understood correctly, e.g. because its callers or tests weren't visible."
                },
                "hunks": {
                  "type": "array",
                  "minItems": 1,
                  "items": {
                    "type": "object",
                    "additionalProperties": false,
                    "required": ["index", "old_start", "old_lines", "new_start", "new_lines"],
                    "properties": {
                      "index": {
                        "type": "integer",
                        "minimum": 0,
                        "description": "0-based position of this hunk among this file's hunks, in the order they appear in `git diff`."
                      },
                      "old_start": { "type": "integer", "minimum": 0 },
                      "old_lines": { "type": "integer", "minimum": 0 },
                      "new_start": { "type": "integer", "minimum": 0 },
                      "new_lines": { "type": "integer", "minimum": 0 },
                      "label": {
                        "type": "string",
                        "description": "Short label for the hunk, e.g. a function name it falls in — the text after the second '@@' in the hunk header, if present."
                      },
                      "note": {
                        "type": "string",
                        "description": "Optional short note about this specific hunk."
                      },
                      "watchpoints": {
                        "type": "array",
                        "items": {
                          "type": "object",
                          "additionalProperties": false,
                          "required": ["line", "note"],
                          "properties": {
                            "line": {
                              "type": "integer",
                              "minimum": 1,
                              "description": "New-file line number this watchpoint applies to (old-file line number for a pure-deletion hunk, which has no new-file side)."
                            },
                            "note": {
                              "type": "string",
                              "description": "Why this exact line needs a second look. A concrete correctness/security/data-risk concern, never a style or naming nit."
                            }
                          }
                        },
                        "description": "Real risk points on specific lines in this hunk. Omit entirely if there are none — most hunks have none."
                      }
                    }
                  }
                }
              }
            }
          }
        }
      }
    }
  }
}
